Course_Num,Dept,Num,Title
2056,PLSC,21390,Philosophy of Poverty
2057,PLSC,21410,Advanced Theories of Gender and Sexuality
2058,PLSC,21499,Philosophy and Philanthropy
2059,PLSC,21505,"Sex, Gender and War"
2060,PLSC,21820,Global Justice and the Ethics of Immigration
2061,PLSC,22150,Contemporary African American Politics
2062,PLSC,22202,Philosophies of Environmentalism and Sustainability
2063,PLSC,22300,American Law and the Rhetoric of Race
2064,PLSC,22400,Public Opinion
2065,PLSC,22600,Introduction to Political Philosophy
2066,PLSC,22700,Happiness
2067,PLSC,22819,Philosophy of Education
2068,PLSC,22913,The Practice of Social Science Research
2069,PLSC,23100,Democracy and the Information Technology Revolution
2070,PLSC,23113,Black Feminism in a Transnational Perspective
2071,PLSC,23313,Democracy and Equality
2072,PLSC,23900,Thucydides
2073,PLSC,23901,The Federalist Papers and Anti-Federalist Writings
2074,PLSC,24201,Liberalism
2075,PLSC,24807,Positive Political Theory
2076,PLSC,24810,Politics of the U.S. Congress
2077,PLSC,25101,"Three Erotic Dialogues: Plato, Xenophon, Plutarch"
2078,PLSC,25110,Empire and International Justice
2079,PLSC,25205,Racial Justice and Injustice
2080,PLSC,25215,The American Presidency
2081,PLSC,25501,Race and Imperialism in the 20th Century
2082,PLSC,25818,Stoic Ethics Through Roman Eyes
2083,PLSC,26005,International Relations of South Asia
2084,PLSC,26152,A Right to Belong
2085,PLSC,26300,Comparative Politics of the Middle East and North Africa
2086,PLSC,26615,Democracy's Life and Death
2087,PLSC,26703,Political Parties in the United States
2088,PLSC,26920,"Freedom, Justice and Legitimacy"
2089,PLSC,27216,Machiavelli's Political Thought
2090,PLSC,27301,Weimar Political Theology: Schmitt and Strauss
2091,PLSC,27500,Organizational Decision Making
2092,PLSC,27510,Latino Politics
2093,PLSC,27818,Philosophical Foundations of Public Policy
2094,PLSC,28006,Intro to Social Choice and Electoral Systems
2095,PLSC,28300,Seminar on Realism
2096,PLSC,28400,American Grand Strategy
2097,PLSC,28620,The Intelligible Self
2098,PLSC,28701,Introduction to Political Theory
2099,PLSC,28800,Introduction to Constitutional Law
2100,PLSC,28801,Introduction to American Politics
2101,PLSC,28850,Chinese Foreign and Global Policy
2102,PLSC,28900,Strategy
2103,PLSC,28901,Introduction to Comparative Politics
2104,PLSC,29000,Introduction to International Relations
2105,PLSC,29102,Game Theory I
2106,PLSC,29411,Consequentialism from Bentham to Singer
2107,PLSC,29700,Independent Study
2108,PLSC,29800,BA Colloquium
2109,PLSC,29900,BA Thesis Supervision
2110,PSYC,20000,Fundamentals of Psychology
2111,PSYC,20100,Psychological Statistics
2112,PSYC,20200,Psychological Research Methods
2113,PSYC,20209,Adolescent Development
2114,PSYC,20300,Biological Psychology
2115,PSYC,20400,Cognitive Psychology
2116,PSYC,20500,Developmental Psychology
2117,PSYC,20600,Social Psychology
2118,PSYC,20700,Sensation and Perception
2119,PSYC,20850,Introduction to Human Development
2120,PSYC,21100,Human Development Research Designs in Social Sciences
2121,PSYC,21135,Zero to Infinity: The Psychology of Numbers
2122,PSYC,21510,Neuroscience of Communication
2123,PSYC,21750,Biological Clocks and Behavior
2124,PSYC,21950,"Language, Culture, and Thought"
2125,PSYC,22350,Social Neuroscience
2126,PSYC,22580,Child Development in the Classroom
2127,PSYC,23000,Cultural Psychology
2128,PSYC,23200,Introduction to Language Development
2129,PSYC,23820,Attention and Working Memory in the Mind and Brain
2130,PSYC,23860,Beyond Good and Evil: The Psychology of Morality
2131,PSYC,24055,The Psychological Foundations of Wisdom
2132,PSYC,24133,Neuroscience of Seeing
2133,PSYC,24231,Methods in Computational Neuroscience
2134,PSYC,24280,The Psychology and Neurobiology of Emotion
2135,PSYC,25101,The Psychology of Decision Making
2136,PSYC,25120,Child Development and Public Policy
2137,PSYC,25280,The Psychology of Close Relationships
2138,PSYC,25300,"Social Context, Biology, and Health"
2139,PSYC,25700,The Psychology of Negotiation
2140,PSYC,25750,The Psychology and Neurobiology of Stress
2141,PSYC,25901,Psychology for Citizens
2142,PSYC,26350,Clinical Cognitive Neuroscience: Function and Dysfunction
2143,PSYC,26665,Epigenetics in Brain and Behavior
2144,PSYC,27010,Psycholinguistics
2145,PSYC,27950,Evolution and Economics of Human Behavior
2146,PSYC,28401,Gender in the Classroom
2147,PSYC,28791,Behavioral Science and Public Policy
2148,PSYC,28810,From Fossils to Fermi's Paradox: Origin and Evolution of Intelligent Life
2149,PSYC,28850,The Biological Nature of Psychological Problems
2150,PSYC,28910,Animal Models in the Study of Cognition
2151,PSYC,29200,Undergrad Rdgs: Psychology
2152,PSYC,29700,Undergraduate Research in Psychology
2153,PSYC,29800,Honors Seminar: Psychology
2154,PBPL,20000,Economics for Public Policy
2155,PBPL,20235,Computing for Social Sciences
2156,PBPL,20305,Inequality in Urban Spaces
2157,PBPL,21390,Philosophy of Poverty
2158,PBPL,21425,Health in a Changing America: Social Context and Human Rights
2159,PBPL,21501,Environmental Justice
2160,PBPL,22100,Politics and Policy
2161,PBPL,22200,Public Policy Analysis
2162,PBPL,22300,Policy Implementation
2163,PBPL,23000,Organizational Analysis
2164,PBPL,23100,Environmental Law
2165,PBPL,23200,The Economics of Crime
2166,PBPL,23550,Urban Ecology and the Nature of Cities
2167,PBPL,23606,"Political Culture, Social Capital, and The Arts"
2168,PBPL,23650,Revolutionizing Agriculture: Early Modern Technologies for the New Millennium
2169,PBPL,23700,Geographical Issues in Housing and Community Development
2170,PBPL,24102,Environmental Politics
2171,PBPL,24105,Urban Design: The Chicago Experience
2172,PBPL,24308,Reproductive Worlds
2173,PBPL,24605,Introduction to Urban Sciences
2174,PBPL,24701,U.S. Environmental Policy
2175,PBPL,24751,The Business of Non-Profits: The Evolving Social Sector
2176,PBPL,24756,Exploring the Resilient City
2177,PBPL,24901,"Trade, Development and Poverty in Mexico"
2178,PBPL,25003,"Immigration, Law and Society"
2179,PBPL,25004,Punishment and Social Theory
2180,PBPL,25005,Inequality at Work: The Changing Nature of Working Class Jobs and Prospects for Improvement
2181,PBPL,25120,Child Development and Public Policy
2182,PBPL,25216,The American Presidency
2183,PBPL,25220,Constructing a Society of Human Rights: A Psychological Framework
2184,PBPL,25370,Social Justice and Social Policy
2185,PBPL,25405,Child Poverty and Chicago Schools
2186,PBPL,25630,"Poverty, Work, and Family Policy"
2187,PBPL,25663,Urban Studies: Placemaking
2188,PBPL,25831,Comparative Politics and Policy
2189,PBPL,25832,Early Human Capital Development
2190,PBPL,25833,Comparative Social Policy Analysis
2191,PBPL,25840,Odyssey Engaged Nonprofit Practicum
2192,PBPL,25860,"Crime, Justice, and Inequality in the American City"
2193,PBPL,26075,Police and Citizen
2194,PBPL,26200,Field Rsch Proj-1: Pubpol
2195,PBPL,26300,Field Research Project in Public Policy II
2196,PBPL,26205,Big Art - Little Art
2197,PBPL,26301,Field Research Project in Public Policy
2198,PBPL,26400,Quantitative Methods in Public Policy
2199,PBPL,26416,Latin American Extractivisms
2200,PBPL,26433,Practicum in Environmental Management
2201,PBPL,26444,Practicum in Campus Athletics and Environment
2202,PBPL,26501,Social Demography
2203,PBPL,26530,"Environment, Agriculture, and Food: Economic and Policy Analysis"
2204,PBPL,26531,"Environment, Agriculture, and Food: Advanced Economic and Policy Analysis"
2205,PBPL,26690,The Politics of Health Care
2206,PBPL,26705,Economics of Education
2207,PBPL,26836,Labor Economics for Public Policy
2208,PBPL,26885,Women in the Labor Market
2209,PBPL,26988,The Politics of Organizational Ethics
2210,PBPL,27000,International Economics
2211,PBPL,27040,Public Finance and Public Policy
2212,PBPL,27070,Philanthropy: Private Acts and Public Goods
2213,PBPL,27150,China's Economic Development & Transition
2214,PBPL,27156,Urban Design with Nature
2215,PBPL,27325,Urban Ecology in the Calumet Region
2216,PBPL,27809,Violence in the Early Years
2217,PBPL,27818,Philosophical Foundations of Public Policy
2218,PBPL,27821,Urban Schools and Communities
2219,PBPL,27905,Global Health Metrics
2220,PBPL,28050,Remaking Chicago: The City That Works on Social Change
2221,PBPL,28139,"Society, Politics and Security in Israel"
2222,PBPL,28150,U.S. Foreign Policy: Inst & Decision making 21st Century
2223,PBPL,28300,Health Economics and Public Policy
2224,PBPL,28310,Healthcare and Healthcare Reform
2225,PBPL,28350,Education and Development: Policy and Research
2226,PBPL,28375,Political Economy of Development
2227,PBPL,28401,Gender in the Classroom
2228,PBPL,28425,Strategic Behavior and Regulation of Firms
2229,PBPL,28488,Politics and Public Policy in Latin America
2230,PBPL,28501,Process and Policy in State and City Government
2231,PBPL,28510,Bombay/Mumbai: Urban Life/Urban Politics
2232,PBPL,28525,Missing Markets: The Economics of the Environment
2233,PBPL,28528,Household Finance: Theory and Applications
2234,PBPL,28538,Political Economy of Natural Resources
2235,PBPL,28550,Social Experiments: Design and Experimentation
2236,PBPL,28605,Economic Analysis of Law
2237,PBPL,28640,Mixed Methods Approaches to Policy Research
2238,PBPL,28678,Massive Change: Finance & Economics
2239,PBPL,28702,Electoral Politics
2240,PBPL,28730,Insurgency in South and Southeast Asia
2241,PBPL,28747,The Modern Welfare State
2242,PBPL,28750,"Conflict: Root Causes, Consequences, and Solutions for the Future"
2243,PBPL,28775,Poverty and Economic Development
2244,PBPL,28780,The Art and Science of Negotiations and Persuasion
2245,PBPL,28791,Behavioral Science and Public Policy
2246,PBPL,28805,Behavioral Economics and Policy
2247,PBPL,28820,Machine Learning and Policy
2248,PBPL,28829,Artificial Intelligence for Public Policy
2249,PBPL,28871,Constitutional Law
2250,PBPL,28891,The Supreme Court and Public Policy
2251,PBPL,28900,Environmental and Science Policy
2252,PBPL,28920,"Inequality: Origins, Dimensions, and Policy"
2253,PBPL,28923,Health Impacts of Transportation Systems
2254,PBPL,28957,The Social Psychology of Behavior in Organizations
2255,PBPL,29000,Energy and Energy Policy
2256,PBPL,29050,Youth Law and Policy: Child Welfare and Juv. Just. in the U.S
2257,PBPL,29120,Poverty Law and Policy Reform
2258,PBPL,29355,Leading Complex Organizations
2259,PBPL,29404,"Inequality, Household Finance, and Tax Policy"
2260,PBPL,29411,"Mediation, Moderation, and Spillover Effects"
2261,PBPL,29600,Internship: Public Policy
2262,PBPL,29700,Reading and Research: Public Policy
2263,PBPL,29701,"Readings and Research: Working Group in Environment, Agriculture, and Food (EAF"
2264,PBPL,29702,"Readings and Research: Working Group in Environment, Agriculture, and Food (EAF) II"
2265,PBPL,29800,BA Seminar: Public Policy I (credit
2266,PBPL,29801,BA Seminar: Public Policy II (no credit
2267,PBPL,29900,BA Paper Preparation: Public Policy
2268,RLST,10100,Introduction to Religious Studies
2269,RLST,11004,Introduction to the Hebrew Bible
2270,RLST,11030,Introduction to the Qur'an
2271,RLST,12000,Introduction to the New Testament: Texts and Contexts
2272,RLST,20111,History of Death
2273,RLST,20401,Islamic Thought and Literature I
2274,RLST,20402,Islamic Thought and Literature II
2275,RLST,20403,Islamic Thought and Literature III
2276,RLST,20501,Islamic History and Society I: The Rise of Islam and the Caliphate
2277,RLST,20505,Pagans and Christians: Greek Backgrounds to Early Christianity
2278,RLST,21107,Rdg: Maimonides' Guide of the Perplexed
2279,RLST,21303,"Christianity and Slavery in America, 1619-1865"
2280,RLST,21450,Coptic Bible
2281,RLST,22010,Jewish Civilization I: Ancient Beginnings to Early Medieval Period
2282,RLST,21600,Early Monasticism
2283,RLST,22011,Jewish Civilization II: Late Medieval to Modern Period
2284,RLST,23026,"Suffering, Tragedy, and the Human Condition"
2285,RLST,22800,African American Religion: Themes and Issues
2286,RLST,23100,Introduction to Christian Thought
2287,RLST,23905,Is Buddhism a Religion
2288,RLST,23505,Environmental Ethics
2289,RLST,24110,The Ethics of War: Reading Just and Unjust Wars: A Moral Argument with Historical Illustrations
2290,RLST,24201,Indian Philosophy I: Origins and Orientations
2291,RLST,24202,Indian Philosophy II: The Classical Traditions
2292,RLST,25105,Readings in Ibn Tufayl's Hayy b. Yaqzan
2293,RLST,26002,Literature and Hunger
2294,RLST,27250,Religious Trials
2295,RLST,27614,Problems in the Study of Gender and Sexuality: Gender and Religion
2296,RLST,27650,Anthropology of Religion
2297,RLST,28206,Dostoevsky's Brothers Karamazov
2298,RLST,28511,Star Wars and Religion
2299,RLST,28900,"Magic, Science, and Religion"
2300,RLST,29700,Reading/Research: Rlst
2301,RLST,29800,BA Paper Seminar I
2302,RLST,29900,BA Paper II
2303,CATA,12200,Catalan for Speakers of Romance Languages I
2304,CATA,12300,Catalan for Speakers of Romance Languages II
2305,CATA,21100,"Llengua, societat i cultura I"
2306,CATA,21200,"Llengua, Societat i Cultura II"
2307,CATA,21600,"Catalan Culture and Society: Art, Music, and Cinema"
2308,CATA,21900,Contemporary Catalan Literature
2309,CATA,24019,The Translation Zone: Languages in Catalan-Speaking Territories
2310,CATA,29700,Readings in Special Topics
2311,FREN,10100,Beginning Elementary French I
2312,FREN,10200,Beginning Elementary French II
2313,FREN,10300,Beginning Elementary French III
2314,FREN,10123,Summer Intensive Elementary French
2315,FREN,14100,French for Romance Language Speakers
2316,FREN,20100,"Language, History, and Culture I"
2317,FREN,20200,"Language, History, and Culture II"
2318,FREN,20300,"Language, History, and Culture III"
2319,FREN,20500,Ecrire en français
2320,FREN,20601,Expression orale et phonétique
2321,FREN,20602,Expression orale : Décrire l'art moderne et contemporain en français
2322,FREN,23333,Reading French for Research Purposes
2323,FREN,21903,Introduction à la littérature française III: Littérature à l'Age des Révolutions
2324,FREN,22619,Paris and the French Revolution
2325,FREN,22818,Figures du poète au XXème siècle (1900-1950
2326,FREN,22910,Medieval Beasts
2327,FREN,23219,The Medieval Mediterranean
2328,FREN,23404,French Cinema of the 1930s
2329,FREN,23500,Caribbean Fiction: Self-Understanding and Exoticism
2330,FREN,23660,Baudelaire et Flaubert: la vie littéraire en l'an 1857
2331,FREN,23810,Memory and Identity in French Literature: Proust to the Present
2332,FREN,24110,L'écriture du quotidien au XXe siècle
2333,FREN,25000,Molière
2334,FREN,25220,Pour une sociologie de Rabelais
2335,FREN,26043,"Versailles: Art, Power, Resistance and the Sun King's Palace"
2336,FREN,27400,Autobiographies Maghrébines: de l'Ecriture de Soi à l'Ecriture de l'Histoire
2337,FREN,29100,Pascal and Simone Weil
2338,FREN,29322,"Europe's Intellectual Transformations, Renaissance through Enlightenment"
2339,FREN,29700,Readings in Special Topics
2340,FREN,29900,BA Paper Preparation: French
2341,RLLT,38800,"Foreign Language Acquisition, Research and Teaching"
2342,SOSC,27501,Civilisation Européenne I
2343,SOSC,27601,Civilisation Europeenne-2
2344,SOSC,27701,Civilisation Europeenne-3
2345,ITAL,10100,Beginning Elementary Italian I
2346,ITAL,10200,Beginning Elementary Italian II
2347,ITAL,10300,Beginning Elementary Italian III
2348,ITAL,12200,Italian for Speakers of Romance Languages
2349,ITAL,20100,"Language, History, and Culture I"
2350,ITAL,20200,"Language, History, and Culture II"
2351,ITAL,20300,"Language, History, and Culture III"
2352,ITAL,20400,Corso di perfezionamento
2353,ITAL,16000,"Italian Renaissance: Dante, Machiavelli, and the Wars of Popes and Kings"
2354,ITAL,22101,Dante's Divine Comedy-3: Paradiso
2355,ITAL,22900,Vico's New Science
2356,ITAL,23101,Early Italian Lyric: Dante and His Rivals
2357,ITAL,24218,Unveiling Chivalry: Chivalric literature in Medieval and Early Modern Europe (1100-1600
2358,ITAL,25218,Reading Nonhuman Animals: A Challenge to Anthropocentrism
2359,ITAL,26500,Renaissance Demonology
2360,ITAL,27500,Women and the Mafia in Contemporary Italian Cinema
2361,ITAL,27700,The (Auto)Biography of a Nation: Francesco De Sanctis and Benedetto Croce
2362,ITAL,28219,"Negative Empathy, Catharsis, Fear: An Intermedial Approach to Tragedy and Its Transformations"
2363,ITAL,28400,Pasolini
2364,ITAL,29600,The Worlds of Harlequin: Commedia Dell'arte
2365,ITAL,29700,Readings in Special Topics
2366,ITAL,29900,BA Paper Preparation: Italian
2367,PORT,10100,Beginning Elementary Portuguese I
2368,PORT,10200,Beginning Elementary Portuguese II
2369,PORT,10300,Beginning Elementary Portuguese III
2370,PORT,12200,Portuguese For Spanish Speakers
2371,PORT,13120,Accelerated Portuguese for Speakers of Romance Languages
2372,PORT,14100,Portuguese for Speakers of Romance Languages
2373,PORT,14500,Portuguese for the Professions: Intensive Business Portuguese
2374,PORT,20100,Intermediate Portuguese
2375,PORT,20200,Advanced Portuguese
2376,PORT,21500,Curso de Aperfeiçoamento
2377,PORT,27200,Introduction to Brazilian Culture
2378,PORT,29700,Readings in Special Topics
2379,SPAN,10100,Beginning Elementary Spanish I
2380,SPAN,10200,Beginning Elementary Spanish II
2381,SPAN,10300,Beginning Elementary Spanish III
2382,SPAN,10123,Summer Intensive Elementary Spanish
2383,SPAN,20100,"Language, History, and Culture I"
2384,SPAN,20200,"Language, History, and Culture II"
2385,SPAN,20300,"Language, History, and Culture III"
2386,SPAN,20102,"Language, History, and Culture for Heritage Speakers I"
2387,SPAN,20202,Intermediate Spanish for Heritage Speakers
2388,SPAN,20302,"Language, History, and Culture for Heritage Speakers III"
2389,SPAN,20304,Spanish for the Professions
2390,SPAN,20400,Composición y conversación avanzada I
2391,SPAN,20500,Composición y conversación avanzada II
2392,SPAN,20602,Discurso académico para hablantes nativos
2393,SPAN,23333,Reading Spanish for Research Purposes
2394,SPAN,21100,Las regiones del español
2395,SPAN,21703,Introducción a las literaturas hispánicas: textos españoles clásicos
2396,SPAN,21803,Introducción a las literaturas hispánicas: textos españoles contemporáneos
2397,SPAN,21903,Intro. a las lit. hispánicas: textos hispanoamericanos desde la colonia a la independencia
2398,SPAN,21910,Contemporary Catalan Literature
2399,SPAN,22003,Introducción a las literaturas hispánicas: del modernismo al presente
2400,SPAN,22218,De capa y espada: Martial Arts Culture in the Spanish Golden Age
2401,SPAN,23201,"Art, Ekphrasis, and Myth in Early Modern Spanish Theater"
2402,SPAN,23219,Leyes del deseo: miradas queer en España y Latinoamérica
2403,SPAN,23619,Music and Ethnic Authenticity in Mexico and Cuba
2404,SPAN,24019,The Translation Zone: Languages in Catalan-Speaking Territories
2405,SPAN,24202,Don Quixote
2406,SPAN,25818,Signs of the Americas
2407,SPAN,26555,Self-determination and Democracy in Spain: The Case of Catalonia
2408,SPAN,29117,Theater and Performance in Latin America
2409,SPAN,29700,Readings in Special Topics
2410,SPAN,29900,BA Paper Preparation: Spanish
2411,BCSN,10103,First-Year Bosnian/Croatian/Serbian I
2412,BCSN,10203,First-Year Bosnian/Croatian/Serbian II
2413,BCSN,10303,First-Year Bosnian/Croatian/Serbian III
2414,BCSN,20103,Second-Year Bosnian/Croatian/Serbian I
2415,BCSN,20203,Second-Year Bosnian/Croatian/Serbian II
2416,BCSN,20303,Second-Year Bosnian/Croatian/Serbian III
2417,BCSN,21100,Advanced BCS: Literary Readings
2418,BCSN,21101,Advanced Bosnian/Croatian/Serbian: Language through Fiction
2419,BCSN,21200,Advanced Bosnian/Croatian/Serbian: Language Through Film
2420,BCSN,21300,(Re)Branding the Balkan City: Comtemp. Belgrade/Sarajevo/Zagreb
2421,BCSN,21400,Advanced BCS: Language through Art and Architecture
2422,BCSN,29701,Intensive BCS Language and Culture Study
2423,CZEC,10203,First-Year Czech-2
2424,CZEC,10303,First Year Czech-3
2425,CZEC,20103,Second Year Czech-1
2426,CZEC,29700,Reading and Research Course
2427,CZEC,29900,BA Paper
2428,POLI,10103,First-Year Polish I
2429,POLI,10203,First-Year Polish II
2430,POLI,10303,First Year Polish-3
2431,POLI,20103,Second-Year Polish I
2432,POLI,20203,Second-Year Polish II
2433,POLI,20303,Second-Year Polish-3
2434,POLI,20403,Third Year Polish-1
2435,POLI,20503,Third-Year Polish - 1
2436,POLI,20603,Third-Year Polish-3
2437,POLI,20700,Third-Year Polish III
2438,POLI,24300,Polish Through Literary Readings III
2439,POLI,27100,From Poland to Popland
2440,POLI,29700,Reading/Research: Polish
2441,RUSS,10103,First-Year Russian-1
2442,RUSS,10123,Summer Intensive Introductory Russian
2443,RUSS,10203,First-Year Russian-2
2444,RUSS,10303,First-Year Russian-3
2445,RUSS,10400,Russian Through Pushkin I
2446,RUSS,10500,Russian through Pushkin II
2447,RUSS,10600,Russian through Pushkin III
2448,RUSS,20103,Second-Year Russian-1
2449,RUSS,20104,Second-Year Russian Studies-1
2450,RUSS,20203,Second-Year Russian-2
2451,RUSS,20204,Second-Year Russian Studies - 2
2452,RUSS,20303,Second-Year Russian-3
2453,RUSS,20304,Second-Year Russian Studies III
2454,RUSS,20702,Third-Year Russian through Culture I
2455,RUSS,20802,Third-Year Russian through Culture II
2456,RUSS,20902,Third-Year Russian through Culture III
2457,RUSS,21302,Advanced Russian Thru Media-1
2458,RUSS,21402,Adv Russian Through Media-2
2459,RUSS,21502,Adv Russian Through Media-3
2460,RUSS,21600,Russian For Heritage Learners
2461,RUSS,23333,Reading Russian for Research Purposes
2462,RUSS,26900,Strangers to Ourselves: Twentieth Century Émigré Literature from Russia and SE Europe
2463,RUSS,29910,Special Topics in Advanced Russian
2464,RUSS,29911,Special Topics in Advanced Russian
2465,RUSS,29912,Special Topics in Advanced Russian
2466,REES,13803,The Soviet Union
2467,REES,20004,Nabokov: Lolita
2468,REES,20007,Pushkin and His Age
2469,REES,20011,Gogol
2470,REES,20013,Dostoevsky
2471,REES,20020,Pale Fire
2472,REES,20021,Dostoyevsky's Crime and Punishment
2473,REES,20200,Dostoevsky's Brothers Karamazov
2474,REES,21000,Gombrowicz: The Writer as Philosopher
2475,REES,21006,"Joseph Conrad's Secret Agent: (In)action, Surveillance, Terrorism"
2476,REES,21101,Advanced Bosnian/Croatian/Serbian: Language through Fiction
2477,REES,21300,(Re)Branding the Balkan City: Comtemp. Belgrade/Sarajevo/Zagreb
2478,REES,21502,Adv Russian Through Media-3
2479,REES,22007,Milan Kundera
2480,REES,22008,The Fact of the Prague Spring: 1949-1989
2481,REES,22402,Fate and Duty: European Tragedy from Aeschylus to Brecht
2482,REES,23005,Russia's 3 Cinemas: BETW Politics and Cultures
2483,REES,23015,Cinema and Poetry: The Modern City
2484,REES,23019,"Europe Betw Black & Baltic Seas, Betw Russ & EU"
2485,REES,23020,When Moscow was Paris
2486,REES,23108,Contact Linguistics
2487,REES,23115,Old Church Slavonic
2488,REES,23119,Language/Power/Identity in South East Europe
2489,REES,23137,Narratives Suspense in European/Russian Lit/Film
2490,REES,23141,Avant-Garde in East Central Europe
2491,REES,23153,Modern Central European Literature
2492,REES,23157,Central Asian Cinema
2493,REES,24002,The Non-Aligned Movement: From Bandung to Belgrade and Beyond
2494,REES,24401,"Vampires, Villains, & Magic: The Supernatural in Eastern Euro"
2495,REES,24403,Puppet Theory
2496,REES,24410,Animation in the Eastern Bloc
2497,REES,24414,Soviet Science Fiction
2498,REES,24415,The Intelligentsia: On Slavic Social Thought
2499,REES,24416,Russian Literature in the Composer's Ear
2500,REES,25001,Introduction to the Musical Folklore of Central Asia
2501,REES,25003,Philosophy of Architecture
2502,REES,25005,History of International Cinema II: Sound Era to 1960
2503,REES,25600,Realism in Russia
2504,REES,25603,Media and Power in the Age of Putin and Trump
2505,REES,25701,Memoir in Modernism
2506,REES,26011,Intro to Russian Civilization-1
2507,REES,26012,Intro Russian Civilization-2
2508,REES,26017,The Soviet Visual Experience
2509,REES,26019,Symbolism and Cinema
2510,REES,26047,Pushkin and Gogol
2511,REES,26064,Revolution
2512,REES,26068,"The Underground: Alienation, Mobilization, Resistance"
2513,REES,26071,Film and Revolution
2514,REES,26075,For Science Fiction in Eastern Europe and Russia
2515,REES,26076,Russian Modernist Poetry
2516,REES,26077,Russian Modernist Theater
2517,REES,26660,The Rise of the Global New Right
2518,REES,27026,Kieslowski: The Decalogue
2519,REES,27027,Cinema and the Holocaust
2520,REES,27028,David Bergelson's Strange New World
2521,REES,29007,The Brighter Side of the Balkans: Humor & Satire in Lit & Film
2522,REES,29009,Balkan Folklore
2523,REES,29010,20th Century Russian & South East European Emigre Literature
2524,REES,29012,Returning the Gaze: The Balkans and Western Europe
2525,REES,29013,The Burden of History: The Nation and Its Lost Paradise
2526,REES,29016,"Gender in the Balkans: Wounded Men, Sworn Virgins, Eternal Mothers"
2527,REES,29018,Imaginary Worlds: The Fantastic and Magic Realism in Russia and Southeastern Europe
2528,REES,29021,The Shadows of Living Things: The Writings of Mikhail Bulgakov
2529,REES,29023,Returning the Gaze: The West and the Rest
2530,REES,29024,States of Surveillance
2531,REES,29700,Reading/Research: Russian and Eastern European Studies
2532,REES,29701,Reading/Research: Russian and Eastern European Studies II
2533,REES,29702,Studies III
2534,REES,29800,Reading/Research: Czech
2535,REES,29801,Intercultural Adaptation: Kurosawa and His Russian Sources
2536,REES,29811,The Novel-Essay and its Past
2537,REES,29900,BA Paper Workshop
2538,REES,29912,Special Topics in Advanced Russian
2539,SOCI,20000,Invitation to Sociology
2540,SOCI,20001,Sociological Methods
2541,SOCI,20002,Social Structure and Change
2542,SOCI,20004,Statistical Methods of Research
2543,SOCI,20005,Sociological Theory
2544,SOCI,20101,Organizational Analysis
2545,SOCI,20103,Social Stratification
2546,SOCI,20104,Urban Structure and Process
2547,SOCI,20107,Sociology of Human Sexuality
2548,SOCI,20125,Rational Foundations of Social Theory
2549,SOCI,20126,Japanese Society: Functional/Cultural Explanations
